{
  "result_id": "final-0001",
  "job_id": "img-job-0001",
  "version": 1,
  "status": "approved",
  "image": {
    "asset_id": "asset-final-001",
    "uri": "mock://outputs/img-job-0001/final-v1.webp",
    "media_type": "image/webp",
    "width": 1600,
    "height": 1200
  },
  "validation": {
    "validation_id": "val-final-0001",
    "job_id": "img-job-0001",
    "stage": "final_validation",
    "passed": true,
    "score": 0.88,
    "summary": "The final mock output matches the brief and blueprint.",
    "issues": [],
    "evidence": [
      {
        "source_type": "mock_fixture",
        "source_id": "asset-final-001",
        "summary": "Mock final image packet has passed validation.",
        "confidence": 1
      }
    ],
    "checked_at": "2026-05-12T18:19:00Z"
  },
  "generation_attempt_id": "gen-0001",
  "created_at": "2026-05-12T18:19:30Z"
}
